text,category
"loved the service from the staff at Newark today. 

Good service goes along way.

I appreciate your preciation  

Nj ✈️Tampa 

🔵🔵🔵",Satisfied
Don't show these to Larry Fedora. RT : Our fleet's on fleek. http://t.co/qqlzk2jkzR,Satisfied
lolol,Satisfied
shows us their sense of humor with these tongue-in-cheek flight etiquette videos: http://t.co/GGuAA1JvDF,Satisfied
true. Maybe. Wish I had expedited security haha,Satisfied
Why “: Our fleet's on fleek. http://t.co/a7NvbJ8ipx”,Satisfied
Power Moves RT : Our fleet's on fleek. http://t.co/t9s68korSN,Satisfied
STOP THIS “: Our fleet's on fleek. http://t.co/Ac6zwmuOOn”,Flight Issue
Lmfaooo “: Our fleet's on fleek. http://t.co/1G9RnmYUQe”,Satisfied
"""LOL you guys are so on it"" - me, had this been 4 months ago...“: Our fleet's on fleek. http://t.co/LYcARlTFHl”",Satisfied
"wow, keeping up with the times...",Satisfied
We didn't need this. RT : Our fleet's on fleek. http://t.co/cpZB285o71,Flight Issue
I always look forward to JB RT :  :) Looking forward to welcoming you onboard! 💙,Satisfied
any info on why flight 704 from SJU to JFK is already delayed 2 1/2 hours?,Flight Issue
toss this ticket...it's great PR and I'm sure every college student following me will be willing to rock out wit too 👀👀,Satisfied
“: Our fleet's on fleek. http://t.co/3kVkd8yRxa” + lol wow,Satisfied
Lovely! RT : Our fleet’s on fleek. http://t.co/Hi6Fl1AX9E,Satisfied
"Yall tried it. "": Our fleet's on fleek. http://t.co/62GoDFaKNB”",Satisfied
my family and I are excited to see you too😊😊,Satisfied
"I love flying with u, but I have a question, why is one of ur planes called ny jets",Satisfied
sounds good!!!💙💙💙💙,Satisfied
“: Our fleet's on fleek. http://t.co/JMnkJ6Bmc2” Jet Blizzue in the hizouse.,Satisfied
"Very excited, for the first time this Sunday, March 1 I get to fly #JetBlue flight 123 #Mint from JFK. Looking forward :-)",Satisfied
hahah 😂👌👌👌 love flying jet blue tho!! http://t.co/7VeE44MACM,Satisfied
“: Our fleet's on fleek. http://t.co/vOUUFRN4jS” YASSS JetBlue ! Tell them !,Satisfied
"lmfao, i love it",Satisfied
I have a little more time then that..lol. Well actually a lot more. 36 days more. But I'm just excited!!,Satisfied
LMAO “: Our fleet's on fleek. http://t.co/aIyC9WV5oq”,Satisfied
well here we go,Satisfied
“: Our fleet's on fleek. http://t.co/kVXs1lCqLp”  new fav airline,Satisfied
Hopefully now my application for JetBlue donut designer will finally go through the proper channels.,Satisfied
Looking cool,Satisfied
Definitely! Lots of announcements and the app is great.,Satisfied
you bet:),Satisfied
Sure did go south after breakfast though! Delayed three hours. :( :( :(,Flight Issue
thank you. Appreciate that!!,Satisfied
The chairs could use some TLC. And more power outlets in the area would be a bonus. Headed to  !,Satisfied
Thanks. Used phone instead of computer and it worked!! Thx again!,Satisfied
"alright .... done! alternatively, if you'd like to charter a private jet for me to PITT i will gladly accept :)",Satisfied
great job getting flight 28 in 10 minutes early. Too bad we're at 50 minutes and counting waiting for our bags.,Luggage Issue
"All good, I just have 2 remind myself that if this was 1914 I might be on a horse &amp; buggy. So what's a little delay right.",Flight Issue
"good to know, thanks so much!",Satisfied
Unhappy with 4 hour delayed flight.. Missed dinner,Flight Issue
Thank you for the quick response! I am trying to request abassinet for my son. it would be great if you can help me with my request,Satisfied
Mark T.  in Austin was great handling my bag issue.  #thanks,Satisfied
"Good one! And indeed, it's JetBlue's finest day in history!",Satisfied
thanks! Calling right now!,Satisfied
Haha. Thanks. You guys are great. Unlike the . ;-) #GoPatriots!,Satisfied
thanks,Satisfied
it was booked through work but added upgrade on seat. Need the upgrade receipt.,Satisfied
Thank you for the free flyfi!! Makes an already great airline even better! #jetblue #Boston #westpalmbeach #flybetter,Satisfied
thank you!!,Satisfied
I wish you all the best of luck :-) I'm enjoying the luxurious free!! amount of leg space rn. Thanks,Satisfied
great to see the RedSox plane and your reminder you ❤️NY side by side at JFK #catsanddogslivingtogether http://t.co/KFUyYoKUFv,Satisfied
what is the deal with flt 460 today? Departure keeps changing. When is it going why is it so Late Flight?,Flight Issue
"lol at your ""estimated departure time."" Plane hasn't even started boarding yet. You can't even get your delays right.",Flight Issue
no I asked. Either way it doesn't make the flight less delayed.,Flight Issue
2324 from Orlando to Dca ! And my awesome flight attendant is Robert!,Satisfied
shocker my flight delayed an hour. Thanks for reminding me why I switched to delta.,Flight Issue
are going to let Fl382 into a gate in BOS any time soon? We're just sittin' here on the tarmac  waiting.,Flight Issue
"Thanks JB. Actually, As a birder I love them too. They just need to be outside. It shouldn't be too hard to trap and move them.",Satisfied
"flight from JFK-SFO was pure awesomeness. Mint Class and Tim our attendant was the best! Other airlines, take notes!",Satisfied
last sleep in Cali... back to JFK tomorrow night.  Looking forward to an another amazing flight with you all :),Satisfied
"Woo! Update! Flight 915 is now possibly delayed by more than 2hrs!  Power of positive thinking, people.",Flight Issue
with the free wifi #impressive #FlyFi http://t.co/T1RYpzEBc8,Satisfied
"Didn't find out my flight for NY, scheduled to leave at 9:30pm, is delayed by more than 1.5hrs until AFTER checking in. Huge fail.",Flight Issue
Vegas desk said JFK connect would b held 4 us and 26 others on our plane now staff at JFK says weather was problem. #epicfail,Flight Issue
other jfk to Boston flights went off with some delay but not this.  #epicfail,Flight Issue
mint seats are AWESOME! :-)  best business class in the US!!!,Satisfied
"- WTF, stuck at JFK for 2+ hrs in a delay to Boston cuz u say snow.  No snow on weather map!!!  WTF!!!",Flight Issue
thank you for getting me home. And despite all odds I have reunited with my delinquent Southwest luggage. Now homeward,Satisfied
ok thanks. Safety first.,Satisfied
apparently the plane was delayed coming up from San Juan. Monsoon there today?,Flight Issue
over 2 hour delay going from NYC to Denver! Come on man!,Flight Issue
"- Fix your @#$&amp; jet bridges.  40 minute delay, 2nd gate...still waiting!  #jetblues http://t.co/ncB2oNcS9i",Flight Issue
Kudos well deserved! Just wish the rest of my  experience today measured up to their example!,Satisfied
"ha ha! Can I get a wake up call at boarding time please?  Large coffee, extralight extra sweet please!",Satisfied
didn't work. Fly-fi plus couldn't access ABC app. So I spent $19 and still missed Oscars. #disappointed,Flight Issue
👍. I think I'll come take a nap at the terminal.  ;),Flight Issue
#611 from JFK to LAS still delayed?,Flight Issue
THANK YOU! I am your new big fan :),Satisfied
I do! The best airline wifi ever. Thank you!,Satisfied
"pilot: ""Don't worry folks there's a backup for the backup for every part of this plane."" Thanks guy",Satisfied
thank you! Hopefully it's soon! We are supposed to leave at 11:23,Flight Issue
thank you!,Satisfied
awesome,Satisfied
im still waiting??? No answer!!,Flight Issue
Ok. Thanks for your help.,Satisfied
Love you guys😍😍😍 http://t.co/3X9NRUOvtS,Satisfied
"the amount of money I spent on hotels for a WEEK bc of flight cancelledlation, another flight doesn't make up for the money lost.",Flight Issue
being told JFK had a 5 hour delay this AM which is reason for my delay now. It can't be that hard to notify with 12 hours notice,Flight Issue
"Keep Waiting, time does not cost anything for  hundreds people how payed thousand dollars with no feedback http://t.co/Ji2pg4gom9",Flight Issue
you're still the best,Satisfied
"please give JetBlue all the permissions in the world! I'm missing the oscars right now, and it's awful #whyabcwhy",Satisfied
Thanks. So the delay was the result of scheduling issues more than weather reLate Flightd problems?,Flight Issue
I am less concerned about the delay than I am about not being notified until I looked at the board that my flight was delayed,Flight Issue
Thanks!  I made it 😃,Satisfied
thanks for the quick response! Fingers crossed the plane gets here then,Satisfied
Thank you. Fingers crossed.,Satisfied
". ooookay  that's silly of you. guess we're ""watching"" the oscars purely on Twitter reactions tonight. #oscars",Flight Issue
"2nd time in a row a flight out of jfk a disaster. Last time I wasn't allowed to fly stndby, now a 2 hour delay w/out notification",Flight Issue
. A bunch of flights are delayed from FFL to Northeast destinations. No announcements at the gate. What's going on?,Flight Issue
I did.  They have no idea where it is.,Luggage Issue
"hey JetBlue.  Still waiting to hear where you lost my 9'8"" surfboard between JFK and BQN airports.",Luggage Issue
flight 98 DEN to JFK already 2hrs delayed. Any idea how that might change again due to weather forecast etc?,Flight Issue
"aha, ok. Thanks! Was worried there might not be a seat at all :) Will do it at the airport tomorrow then!",Satisfied
that is a stock response. Delays not as frustrating as poor cust serv &amp; being told by 3 ppl to wait &amp; they'd come back but did not.,Flight Issue
4 hr delay on flight to JFK via Tampa &amp; worst customer service in San Juan airport. This after app not working all day.,Flight Issue
just please get my luggage from #2070 onto carousel 5 / Logan Airport and I'll be able to go home!,Luggage Issue
thanks for the response. Just been waiting for 5 hours and really frustrated. Seems like no one at JetBlue is concerned.,Flight Issue
Tx for the info. Just don't understand why you couldn't accurately estimate departure time earlier. Weather in ny is fine now.,Flight Issue
“:  So glad to hear. Thanks for sharing the video.” Me and JetBlue are #BFF 🙏,Satisfied
thanks for the response. We are hopeful.,Satisfied
Update please on why flight 2601 continues to be further delayed,Flight Issue
all day,Flight Issue
how about free wifi on flt 1254 out of PBI to make up for 2.5 hr delay? Treat us right.,Flight Issue
why is flight 1106 delayed out to NY? Same problem?,Flight Issue
thanks for the update. 'Preciate it. Hope it gets here. Been delayed 2 days getting back,Flight Issue
yes. They are working on it. Hoping bag is on the next flight and will deliver home...,Luggage Issue
thank you for the refund of the change fee for a recent flight affected by our bizarre winter. Excellent customer service and focus,Satisfied
Flight 136 departs 2:14 AM  Finally!!!  Arrived JFK with no psgrs at 5:39 PM.  That's a long flight. AKA BUS http://t.co/KfKjF1ZtGi,Flight Issue
thanks for help. Can't wait to travel with! And get out of the snow.,Satisfied
"last flight was cancelled, then it was 2 hours to change a light bulb, now sitting here waiting for maintenance. Unreal.",Flight Issue
thanks for answering my questions!,Satisfied
anything serious I should worry about?,Flight Issue
cool! Are there stairs at JFK? I can walk short distances but not stairs.,Satisfied
Your scheduling skills failed. The delay went from four hours to nearly six. Don't tell me you were snowbound in PBI.,Flight Issue
", thanks for not guarantee that you can not deli ever my bags to my hotel, when bag missed connection. #sFO #customerservicenot",Luggage Issue
What's your excuse this time for 1117 delay from LGA to TPA? I know the plane is in the air.,Flight Issue
why are there so many delays to north east cities?,Flight Issue
"what's up? Three delays so far, resulting in over three hours of unnecessary, extra waiting.",Flight Issue
"For the record, that was less than a 10-minute turnaround time for the answer from the question.  JetBlue rocks!",Satisfied
"from San Diego with a 4 hour delay to JFK!Even you have a Amex  JetBlue, even having over 50.000 travel miles, you're still nothing",Flight Issue
Third straight time that my flight has been delayed flying with you guys. This will be my last trip with you.,Flight Issue
"you've let me down. 2:15 delay at JFK because of inbound flight from Syracuse, really? #ishouldhavedriven",Flight Issue
thanks for NOT! Sending me an update that our flight was delayed 3 hours. Unbelievable!,Flight Issue
5 hours delayed now in hour increments?  Really?  &amp; as Mosaic I still have to pay $25 to use lounge during this waste of a Sunday?,Flight Issue
"no, I haven't done that yet. Is that something I can do online? Thx!",Luggage Issue
Thank you for the reply. Would've appreciated communication before checking in about the delay. JetBlue used to be my go-to,Flight Issue
"btw, Robin Hayes is speaking at next month's  aviation summit. He ought to give a shout out to his Twitter team. You rock",Satisfied
oh. And thank you for responding,Satisfied
where is it coming from? I thought Tampa?,Flight Issue
exactly why is my flight delayed? 599 BDL to DCA? Can't seem to get an answer,Flight Issue
thanks. We are ticketed on stand by for flight 1970. I hope we make it out. Fingers crossed,Satisfied
at what point in delays can I take a different flight to my destination?,Flight Issue
thank you guys! You are the best! 🙌✈️,Satisfied
love it as always!,Satisfied
"every time I look at the flight status, 30 more minutes is added to the delay. How about some points for trouble??",Flight Issue
"hey awesome peeps, what's up with flight 1159 from Boston? Delayed 3hrs?",Flight Issue
"what a great experience on flight from SFO to JFK; seats, service, food, everything is top quality. I will be back. Very soon!",Satisfied
"Flights 1384 and 1583. I have picked up twice this week for 1583, and both times it was delayed!! 😕",Flight Issue
"What's up with delays to and from Boston today? My sister is trying to go home, and bro-in-law trying to come to RDU. Craziness!",Flight Issue
118 to Boston still sitting,Luggage Issue
thanks for replying-I feel a little better we'll see how it goes ☺️✈️,Satisfied
I waited 3 hrs for my bags and my flight was only 2 hrs,Luggage Issue
"backlog is an hour at most, this is over two!  Unacceptable!!",Flight Issue
your agent told us TSA didn't have a crew to get bags!,Luggage Issue
you guys rock!,Satisfied
my email is my twitter handle followed by gmail ☺👍👍,Satisfied
Awesome! #bestairlineever,Satisfied
is blaming  for flight 584 luggage debacle!  #luggagegate,Luggage Issue
"come on! Already delayed 2+ hrs on flight 1415 as we waited for the pilot to come from Boston, now you reassign him?! Endless trip.",Flight Issue
I only fly Jet Blue,Satisfied
Start including PTO in your getaway packages and I'm all in,Satisfied
thanks. I will use the extra time to do some more shopping! Did somebody say duty free?,Satisfied
's flight Flight Booking Problems experience is pretty great!,Satisfied
thanks for making my trip home #MintyFresh next #brandmance flight I'll take more selfies! #LOVE #travel #business,Satisfied
"I shouldn't have to find them, they should tell us. I've flown Jet Blue since your first month. The experience isn't what it was.",Luggage Issue
if my flight was delayed can I show up at the airport with the appropriate amount of time for the delay or do I have to go on time?,Flight Issue
I'm over that honestly just would like to get going on the journey.,Flight Issue
"If that was the case, why did your alert arrive so Late Flight? Four-hour delay? Don't buy it.",Flight Issue
I understand but wish you would have announced the delay 2 hours earlier vs sitting for 2 hrs at MCO,Flight Issue
what gives? Delayed over 2 hours at MCO to JFK. Every time!,Flight Issue
"“:  Well captured, Brittany! We love the clouds! :)  Enjoy the ride!” Thank you!",Satisfied
"According to your ground staff, it hasn't even been taken off the plane yet!",Flight Issue
. thanks for making an effort. Credit where credit is due: flight 795 delayed 5 hours instead of 8 hours. #fwiw #loweredexpectations,Flight Issue
At what time?  All these passengers were sitting on a hot plane with no air and no communication for over 2 hours. Just wrong,Flight Issue
"flight delayed at JFK 2 hours, then 3 hours, then 8.5 hours? Now it's back to 5 hours with no explanation or apology?",Flight Issue
thanks! Have a good Sunday.,Satisfied
"Flight 1562 had a 4 1/2 hour weather delay, but what is the 45 minute delay in getting bags to tired passengers?",Flight Issue
5hrs on Tarmac yest b4 cancelled .Today 3+ hr delay. Why not send txt/email re: JFK closed &amp; saved all trip 2 sit  again?,Flight Issue
"flying out of BUF 2 BOS, missing captain... Really? Delayed til 2:00... Not happy...",Flight Issue
", it would be nice if the app would actually inform you that a flight is delayed.",Flight Issue
So what about the plane stuck in Newburgh won't start.  It that weather reLate Flightd as well.  These passengers on plane for 10 hrs.,Flight Issue
nope. This 8:45am flight is now not leaving until almost 5pm. 5! I can't believe I paid money for this.,Flight Issue
thank you. We are finally at the gate.,Satisfied
flight to Orlando is unable to serve hot bevies.... So they've made movies and alcohol complimentary. That works,Satisfied
the only update we get is that they have no idea when we will get an update. Way to go. #hopeless,Flight Issue
will you cover the cost of my car service waiting time?!,Flight Issue
Landing! As usual great flight wiyh a great crew. Hello sunny West Palm Beach ! #jetbluerocks,Satisfied
"waiting at HPN on plane more than an hour since landing b/c of no gate, please get us off this plane!",Flight Issue
thanks for making my vacation not worth it again... Currently waiting on the runway for another hour to DEPLANE,Flight Issue
they were amazing and thank you!,Satisfied
according to jfk plenty of planes are landing. No problem there,Flight Issue
Thanks for the THIRD gate change http://t.co/UfBdr5AxeO,Flight Issue
“:  Beautiful shot.. Thanks for sharing. Using #FlyFi to post? ;)” Your welcome! Not on this flight. It was a quickie;),Satisfied
"she helped me with my problem so easily and was so nice, you guys rock!",Satisfied
what happened to our plane meant to leave @ 830? Why do we have to wait for 1 from buffalo? Seems organizational error not weather.,Flight Issue
how much longer to JFK open's I am a diabetic and I need sugar plane don't have nothing,Flight Issue
flight 16 now sent back to the gate even though the app says its leaving. Anyone have a clue? It's 36 and sunny at JFK,Flight Issue
they are now being sent off the plane? Does anyone at JetBlue have a clue?,Flight Issue
your customer service agent Bonnie is amazing on the phone she deserves a promotion!!!,Satisfied
BOS. Everything current now. Thanks for the follow up,Satisfied
thanks for the info. Already doing it now before we board! Looking forward to the future upgrades! #JetBlue http://t.co/5Db9eSBNzG,Satisfied
things happen it's ok just wish I was on the beach and not in the airport,Satisfied
"it's been 3 hours, why have you not sent the plane from the hangar for flight 1533 at JFK? This is absolutely ridiculous.",Flight Issue
I love #JetBlue ! #FlyFi when will we be able to charge our devices on domestic #A320 flights?! Thanks! http://t.co/obqIro1bUJ,Satisfied
still sitting in plane in Newburg. This is getting #ridiculous. No way to treat #loyal customers.,Flight Issue
Touchdown JFK! Well done pilots of JetBlue Flight 226! #JetBlueRocks,Satisfied
what's the delay if the system isn't down?,Flight Issue
don't think any1 rly knows what's goin on. supposed 2 leave at 8:30a then 9a then 9:30a then 10a then 11a then 11:30a. Now 12,Flight Issue
That is not very gracious of  to tell me where I can go BUY water or a snack when our flight is delayed over 3 hours.,Flight Issue
get flight 16 into the air,Flight Issue
"if I had my tux, it'd be a date! #UMosaicMeCrazy http://t.co/hap4gboSTU",Satisfied
Thanks for the personalized customer service! #cannedtweet #autoresponse,Satisfied
It's not so much the delays as the fact that the flight is still coming up as on time on your app. Just give us an honest estimate,Flight Issue
#489. Flight #589 is departing before we even board,Flight Issue
I knew there was a reason u were my favorite airline. Just read you answer on twitter in globe this morning. Great job,Satisfied
it's only because I'm wearing #TrueBlueColors!,Satisfied
That's not what I heard. Weather was fine this morning. Flight 136 was circling for some time.Someone forgot to clean the runway.,Flight Issue
"When it's 30 mins past scheduled time w/ no departure in sight a flight no longer qualifies as ""on time"" #updateyourwebsite #489",Flight Issue
Appreciate the heads up at 10:45 that my 11am flight was delayed bc the crew is stuck in Boston #communicationFAIL #dobetterJetBlue,Flight Issue
"yup we know, not your fault, just not ideal sittin for over an hour but as always your staff is great!",Satisfied
got it. thanks the quick reply.,Satisfied
your app needs updating. Says my flight is on time when we are well past boarding time with 2hr delay http://t.co/BTvpxTZJu0,Flight Issue
had a great experience working with Glenn Coles at Buffalo-Niagara Airport!! Top notch employee,Satisfied
"well, the last update was in the right direction, at least! I'll keep my fingers crossed.",Satisfied
"thx, social media person!",Satisfied
Are there airport-wide delays at BOS or did we just get unlucky with 152?,Flight Issue
"is JFK still closed? Tryna get out of Ft Lauderdale on flight 502, just want to get home to nyc!",Flight Issue
"hmmm it says im following you. We just got de-iced, but still haning around for the runway to clear..",Flight Issue
always #mosaicmecrazy #sunrise #bestairline #nofilterneeded &amp; how can you not love #FlyFi… http://t.co/NY6CS7jRuV,Satisfied
"flt 136 from PHX. Delayed 2 hrs, circle 1 hr, divert to upstate NY, just sitting for 1 hr No communication #horrible",Flight Issue
they miraculously fixed the plane #kudos to shoe ever it was,Satisfied
"all your online resources  say we're on time, but clearly we are not.  This is not very information age of you...",Flight Issue
😭😭😭😭 yall are really better then American Airlines though.,Satisfied
What can I say other than when it comes to my #BrandLoveAffair w/  ur my #soulandinspiration https://t.co/IGkoGyWksr #umosaicmecrazy,Satisfied
"Issue is JFK. Pilot explained once JFK reopens we can get scheduled back there, but why can't we divert to LGA? Closer than ACY!",Flight Issue
Great service from PBI to HPN! Thanks.,Satisfied
Its poor Flight management. There is   no reason why a scheduled 8:00  pm  flight to takr off At 11:00pm .,Flight Issue
"done, thank you!",Satisfied
why is my 910 flight listed on time when its 904AM and I'm not on the plane yet? http://t.co/iEG2ObcEpp,Flight Issue
fly 2301 delayed do to ice at JFK ... Can I switch to a Late Flightr flight for free,Flight Issue
I'm at 4:05  will be nasty in Boston. Have family driving 90 min to pick me up from Erie think flight - what if cancelleded?,Flight Issue
best way to kill nine hours at the airport when all flights are full and the airline won't put you standby? #stranded,Flight Issue
"FLL to MDE, great flight, great customer service, THANKS! 2 mths waiting    to speak to a human at customer service",Satisfied
how about an update on flight 475 leaving tf green delayed,Flight Issue
well they said cancelled on the PA system. Guess they are trying to get a plane from Boston. And not a 100%  confirmed,Flight Issue
that's where we all get on the same page. cancelleded it 45 mins ago.   help flights from  to MCO?,Flight Issue
my flight 475 cancelleded due to lavatory problems. Can't confirm if they are gonna get a flight from Boston Logan Int,Flight Issue
okay thank you! I'll check with them again!,Satisfied
"“:  Good morning, Sylvie! Have a great flight! #yourock” &gt; Thank you #JetBlue!   #JetBlueRocks",Satisfied
They just came out. Thanks for the follow-up. That's why you're the best!,Satisfied
Thanks! See you soon!,Satisfied
"Yep, still waiting for bags at #JFK. What's the holdup? Looks like we are the only flight that got in at this time..??",Luggage Issue
thanks for getting us to NYC -JFK really safely. :-) But srsly? How long does it take to get our checked bags? #eternity #5amMisery,Satisfied
it's ridiculous that I just got home and I was supposed to land 3 hours ago bc I am HELLA tired,Flight Issue
thanks for the response - when is the next flight after the 9:48 flight?,Satisfied
Highlight of my travel is 3 hour delay and de-icing twice. Now sitting in bumper to bumper traffic in taxi to finally get home. 😒,Flight Issue
great flight on a brand new jet. Great seating. Beautiful plane. Big fan of this airline.,Satisfied
thank you! I know the weather in #Boston isn't great. Everyone's tired,Satisfied
oh wow and I'm complaining about two hour on the run way shucks JetBlue NOT GOOD your service was better than this,Flight Issue
I'm curious to know how do you compensate for passengers missing engagements due to a two hour wait on the tar-mat to get to a gate,Flight Issue
thank you thank you!  I finally set up the jetblue app!  Yay!,Satisfied
Thanks for taking me back home today despite Pandora's best efforts to Cancelled Flight the flight. #jetblue #backhome #noplacelikehome,Satisfied
Your airline sounds outstanding and your Twitter feed is clearly extremely useful. Keep up the great work 😊,Satisfied
