text,category
lost bags. Cant reach human. delivery driver says he won't give us carseat until we return loaner. We hv NO loanr.5084773604 HELP,Luggage Issue
Many thanks for your reply! http://t.co/6CGFv02gzb,Satisfied
I really appreciate there not being an easy way to get another flight when mine has been delayed over 2hrs for mechanical reasons,Flight Issue
My bags were supposed to be delivered to NYC last night (missing since Thurs) but are not here. Can someone call me?,Luggage Issue
on hold with 800-428-4322. Flight from DSM to DCA was cancelled (4473). Know when it will fly?,Flight Issue
- almost 2 hrs 30 mins on hold - any idea how much longer?,Flight Issue
Ten hrs Late Flightr and still here on Army cots @ airport waiting for 11am flight. #poorlyhandled #usairheads http://t.co/18fMr06mn6,Flight Issue
"""good news. We've located the crew and made contact with them"". flight was supposed to leave 4 minutes ago. #usairwaysfail",Flight Issue
sad experience today on 4663.  Family on Southwest direct to MCO. My loyalty to USAir = not vacationing with my boys today.,Flight Issue
"job well done from your Philly employee running check,in today. (Tabitha?) helped us in an emergency &amp; vacation saved!!!",Satisfied
"you can't control the weather but you CAN control your systems, processes, people and attitudes. #anotherfail",Flight Issue
You are 0 for 3 so far in on-time flights on this vacation.,Flight Issue
working for me. Tight cx  so they're delaying our flight. Twice. In 20 secs  http://t.co/G3Uy6w28QH,Flight Issue
"my flight got cancelled to Charlotte. Been on hold for an hour, pls pick up!",Flight Issue
unfortunately patience won't get me to my boat that leaves at 4 pm. I was on hold watching all flights fill up.,Flight Issue
not happy!! Trying to get home on cancelled flight&amp; been on hold for 2 hours. Help!! This is just crazy...,Flight Issue
"wow.. Flight cancelled, slept on the floor at the airport and now flight delayed",Flight Issue
8 hrs of wait time is unbelieavle unaccpetable biggest airline in the world should have failback call centers,Flight Issue
"truly been the worst experience this weekend. Delayed, rerouted 3x, now not boarding A 715 flight and says flight is ""on time""",Flight Issue
We've been on hold for over 7 hours after my wife's flight was cancelled.,Flight Issue
forgot to call in the copilot so we're stuck on the plane in PHL. Looking fwd to being stranded in CLT. Day 2 of flight fails.,Flight Issue
your airline also delayed our bags to us for 4 hours &amp; refused to ship them to our local airport #disappointed #stillbagless,Luggage Issue
"worst experience with you. cancelled flight, no voucher and no luggage because ""ramp was broken."" No other ramps in Charlotte??",Flight Issue
"Suggestions , been on hold 2 hrs for flight that is now about to pass departure...Dealing w ny weather, need change",Flight Issue
"I was meant to fly on Sat, you just made it Tues, I can't afford to stay in a hotel for another TWO nights!",Flight Issue
flight to Des Moines cancelled. Unacceptable to be booked on flight on Tuesday because of work commitments. 2hrs on hold,Flight Issue
claims flight cancelled due to weather at destination but Delta has not cancelled flight on same route.,Flight Issue
on hold 2.5 hrs trying to reschedule our flight. Can anyone there please help us?,Flight Issue
"needs two nights at a hotel in phoenix until he can get back to Philly because of plane equipment, crazy!",Flight Issue
we appreciate auto rescheduling our cancelled flight-- but you have nothing sooner than Tuesday? can fly into alternate loc?,Flight Issue
after sitting on the runway for 3 hours i had to leave the airport w/o my luggage. Is this ur 1st day??,Luggage Issue
thx for taking my $600 for a 1way then cancelling 1st flt delay 2nd flt and u top it off by losing my one piece of luggage #usuck,Flight Issue
my flight is cancelled and you guys aren't Answering the phones what do I do ?,Flight Issue
"this is ridiculous.  I have a 6:00 AM flight and two hours of rest, wasted!!!",Flight Issue
thanks! http://t.co/pD7R1lL6Re,Satisfied
after pleading with car service to stay 3 hrs. past pick up they left me and my family but it's ok i have water and crackers!,Flight Issue
who do we voice our concerns to when we can't get home with our 8 month old after waiting to taxi to a gate for 3 hours?,Flight Issue
tell my professors that when I don't show up to class/write my midterm because I'm stuck with no flights home 😠,Flight Issue
Are you guys awake? Need help with delayed flight to get protected on Late Flightr flight from PHL.,Flight Issue
Well if you really didn't like them then she would be on an airplane. #FIOUSAirways 💁,Flight Issue
can you please train your mechanics? Teach them to bring the tools to fix the plane with them and not leave them in the hanger.,Flight Issue
thank you for leaving my 74 y/o grandma stranded because connecting flt could not wait 10 minutes. I will never fly you again,Flight Issue
“:  Please reach out to our crewmember for assistance. Our apologies for the long wait.” #generic,Flight Issue
can you please have your employee that has been called 5 times by the flight crew finish maintenance on US 734 so we can depart!,Flight Issue
delayed depart bc ur flight attendant wasn't there. Then after landing took 3 hrs to get a gate. Now it's another he and NO bags,Flight Issue
surely there are some other ways to help me - I can't really afford another 4 hours now. Pls follow me so we can DM,Flight Issue
I never made a reward reservation becuase no one ever answered the phone. The online one I made got cancelled and I can't change,Flight Issue
even alternate options are allready full...even with hotel voucher...no more room in philly?,Flight Issue
ok thank you! Very helpful! This is why you're my favorite airline!,Satisfied
you airline is doing rather poor right now. In SLC waiting to take off. Was suppose to take off now 2 hours and 3 minutes ago!,Flight Issue
Get new planes then. Got on this plane at 7:50 its 10:20 now and still on tarmac. How ru going to compensate me for this?,Flight Issue
just hit 4hrs.  what is typical wait time right now? should i drive 2h30m to the airport service desk?,Flight Issue
4 hours . How do I change my flight that was cancelled ?,Flight Issue
actually it landed in BWI 30 minutes ago. She is stranded but I have friends to help. You FAILED big time on this one.,Flight Issue
cancelled flight 1796 baggage held hostage at CHL. No communication.,Flight Issue
Delays due to faulty engine light. Great work guys. Coming up on 2 hrs sitting on the plane #WorstAirlineInAmerica,Flight Issue
I have been I hold for 40 min. My 5:50 flight just got cancelled and rescheduled for Monday. This is unacceptable!,Flight Issue
Flight 496. How are u going to compensate me for sitting on the tarmac for 90+ mins and missing my PHX - BOS connection?,Flight Issue
been sitting on the tarmac for 90 mins now bc engine is broken. How are u going to compensate passengers #WorstAirline,Flight Issue
it was your fault the flight was delayed to begin with. I shouldn't have to check my bag if there's a bunch of space,Flight Issue
it is an extreme inconvenience to make ppl check bags when there's a lot of overhead space left. You lie so you're not at fault,Luggage Issue
no more hotel voucher? Everyone had to get one but not me...what do I do? Arrived from Amsterdam #SnowStorm,Flight Issue
"Yep, except this delay was due to a hasty and unwise decision to pushback other plane before the plows were done. #fail.",Flight Issue
pullin some sh** delaying flights again... Smh  http://t.co/Av2rfFHMcV,Flight Issue
flight 837 landed at 10:30 pm and we are still on the plane. Help!!!!!!,Flight Issue
"TRBL experience! 2 hrs on the Tarmac for an inch of snow IN PHL ""No hanger open"" &amp; ""a pile of snow""?  #terriblecommunication",Flight Issue
"help! Flight cancelled, can't call because my phone doesn't work in Europe. Please help? Says I'm booked want to confirm.",Flight Issue
how do I change flights . 3 hours is crazy please help,Flight Issue
please help on hold 3 hours can't change flights I'm stuck here,Flight Issue
depart from where? It departed PHX and was due to land at DCA around 8pm.,Flight Issue
I certainly understand the hold delays for WX reschedules - I've been on for 2hr15min - do you have an estimated wait time?,Flight Issue
And cherry on top-flight 880 was on runway after we landed ON TIME for 45 mins. Still didn't get half the luggage.,Luggage Issue
likelihood of PHL to BDL actually leaving tonight? 2 hour delay so far!,Flight Issue
My brother &amp; his family stranded in CLT tonight bc gate E36 agent wouldn't hold plane for two minutes. Now driving in bad weather,Flight Issue
over an hour is unacceptable wait time. thanks for nothing.  Be sure never to fly you again,Flight Issue
Thanks guys! Got hold of someone. Really awesome service I appreciate it :),Satisfied
"delayed in philly since 130, sitting onTarmac since 8pm flight 1881 plz contact donaldaroberts1.com",Flight Issue
worst trip ever!  Wish pilot would've let me off plane at 12pm during 1st delay.  Now 1030pm and still sitting on runway.,Flight Issue
First class service on US 769 PHL-MCO today from the flight attendant in F. I didn't catch her name but she was top notch!,Satisfied
Oh well. I'll get to Cancun eventually.,Satisfied
hey folks where do you hide luggage when you Cancelled Flight a flight! You have 100 very angry people with no luggage,Luggage Issue
you can send my luggage to my house👋,Luggage Issue
"Eyyyy! Cancelled Flightlations, Flight Booking Problemss, reFlight Booking Problemss, but y'all got me on the same flight out tonight (not tomorrow) &amp; the FC upgrade. Thx!",Satisfied
thanks for letting me know of the 12 hour delay and 2 hours on hold ?,Flight Issue
From here on out when I can at all I'm flying . Since when is a plane getting stuck in a drift for 2 hours a weather issue?,Flight Issue
on hold for 1 hour and 14 min trying to find the luggage flight cancelled where is luggage? http://t.co/i1SfMI7zat,Flight Issue
Never mind that you could have told the gate I was on my way - you could delay 10 mins but not 15?,Flight Issue
and now I'm going to miss my G'ma's Memorial because I didn't #FlyDelta.,Flight Issue
"-Really? U land me in Philly 1.5 hours before my flight, wait 1.5 hours behind a plane you got stuck,",Flight Issue
how about an update with real information?still waiting on Tarmac in Philadelphia.,Flight Issue
you mean 10:30pm. I'd be in vegas by now if I'd been allowed on my original flight.,Flight Issue
"Bravo handling MSP to PHX # 2023 today. Delayed, Late Flightr cancelled. Missed surprise 60th bday which was reason for trip.Never again",Flight Issue
FINALLY leaving 4 home from NC. Will lodge respectful complaints!! Mechanical issue after cleared for runway? #5hourwait #nocrew,Flight Issue
thank you!!!,Satisfied
hour 4 at the gate.,Flight Issue
waited for 3 hours NO LUGGAGE line too long left airport when flight Cancelled Flighted WHERE does luggage GO? On hold for 1 hour so far,Luggage Issue
so you strand my bag in Philly last Sat and strand me in Philly this Sat. thanks for the bullshit.,Flight Issue
Looks like I'm already delayed and will miss my connecting flight in Philadelphia. Do you un-delay your flights?,Flight Issue
"BF has been stuck in CLT all day. Is the lounge offering free ""This weather sucks &amp; we all want to cry"" tequila shots?",Flight Issue
sucks.  Flt 2692 Late Flight by 20 mins missed my connection.  Thanks for the 10 bucks and a middle seat on the next flt.,Flight Issue
"I wasnt  flying your airline tonight, however a friend was and I was present for her help. I flying United and they could learn.",Satisfied
So you cancelled my flight AGAIN? are you paying for my hotel?!,Flight Issue
the plane crew has been as professional and courteous as the gate agents were flustered.,Satisfied
"your ticket agents at gate 4 in Providence airport rocked tonight, especially Kristy, sorry if that is not the correct spelling.",Satisfied
"#ShoutOut 2 Kristie(sp?) from Gate4 @ PVD today. She's a #RockStar, was a tremendous help in a tough situation. #PromoteThatGirl",Satisfied
Thank you for your help today.  I have been a loyal US airways customer and i appreciate your responding to my tweets.,Satisfied
an already pleasant flight from London to Charlotte (US733) was made fantastic by an amazing attendant. Thank you so much Robert!,Satisfied
won't even refund for a flight they cancelled #horriblecustomerservice,Flight Issue
will you fly me to somewhere warm? I'm tired of this snow! :(,Flight Issue
"flt last nght cancelled-mech.probs, flt this am cancelled-snow, finally on a flt home. 1st cls empty &amp; they won't let me sit there",Flight Issue
you're killing me sche a flight to board 3 min after mine arrived with gate on other side of airport #genious,Flight Issue
"woohoo! He still has 1 more flight but so happy to hear they're in the air, just about cried! (Must be the preggo hormones!) thx!",Satisfied
"status shows ""delayed"" it was just ""waiting for takeoff"" so did it depart? It certainly didn't at 4:17pm. http://t.co/emRUbu4WzD",Flight Issue
you're right it's not fun. Especially when I don't have much of a choice. Lol. #curvygirltravels,Flight Issue
Thank you!!! This whole crew has rocked through bad weather and diversion. Pilot keeping us well informed. #customerservice,Satisfied
i hope i get the opportunity to join the team with this job opening!,Satisfied
how is it that my flt to EWR was cancelled yet flts to NYC from USAirways are still flying?,Flight Issue
thank you! You have always been so good to me. I will follow up.,Satisfied
No Problem - he was the only person in the airport who would help :),Satisfied
"thank you! It's # 1875 from BWI, keep seeing different stats, from delayed to awaiting take off to delayed...",Satisfied
Nick on flight 742 was awesome. Please reward him in some way!!! He has kept us smiling on a bad day of travel. #customerservice,Satisfied
sitting on a plane in Philadelphia for over 20 minutes waiting just to get off the plane. Great service!,Satisfied
", another hour gone &amp; they sit with more snow on them! Seriously?! http://t.co/Fupf0UAyir",Flight Issue
"We did.  said to open one with you, too.",Luggage Issue
"to a booked hotel for the night so I had to find him a room at midnight. Then say his bags will be on the plane, but can't (2/3)",Luggage Issue
This is ridiculous. You delayed my husband's flights &amp; made him miss his connection. Told him to leave his bags. Sent him (1/3),Flight Issue
Been tweeting with the team at  who informed me that the problem is that you never sent his bags to them yesterday.,Luggage Issue
Your Baggage system has hung up on me twice because you have too many callers. I NEED TO FIND MY HUSBAND'S () BAGS.,Luggage Issue
big thank you to your ticketing agent Ute V at Dulles-Washington for OUTSTANDING guest service to get me rebooked,Satisfied
"still Effin waiting... Not weather delays, not engine trouble, but lack of crew?  Are you shitting me?",Flight Issue
I love you guys!!!,Satisfied
what am I paying you $275 for?   Fly the damn plane!  Not one announcement from the crew.  Let me know how you wanna refund me.,Flight Issue
"cancelled 4532 sch departure 8:38 am, wasn't snowing yet and other flights were still leaving #Fail",Flight Issue
Can't wait for the trip. Thanks for getting me there!,Satisfied
"Yes, it's February. Bad weather happens every winter. If you guys don't have the business sense to forecast that I'm at a loss.",Flight Issue
in don't have it on me at the time as I am taking Amtrak home. How do we call for partial refunds?,Flight Issue
now what? You cancelled my flight again... Are you paying for my hotel?,Flight Issue
your team member at DCA- Tamara R. is her name was awesome. You should have more employees like her!,Satisfied
thanks for getting us on ur plane. Awesome flight attendant who is making us smile after difficult travel. #customerservice,Satisfied
"had baggage lost last night, no call from us airways and no bags and nobody answering phone #badcustomersrvice #whereismybag",Luggage Issue
"if my flight's been cancelled, and I can't reach anyone over the phone or ticketing agents, safe to assume I wasn't rebooked?",Flight Issue
WHERE IS MY BAG ?#SOS ITIS BEING LOST FOR MORE THAN 24 HOURS ! #POORCUSTUMERSERVICE,Luggage Issue
#SOS WHERE IS MY BAG ?,Luggage Issue
"after 5 flight cancellations we finally get a flight, get to the gate on time &amp; you've given our seats away? Seriously??",Flight Issue
this is ridiculous at CLT  and we missed our connecting flight because of a chuckhole  on runway??  #shameful (1/1),Flight Issue
no one at #clt knows about runway issues..my inbound flight was only one delayed..connection left without me..now I'm stuck!,Flight Issue
what is with all the cancellations to PBI? We have pax at DCA that have been sent to 4 different lines between AAL and AWE. Help!,Flight Issue
"Stars aligned. Connecting flight was delayed into CLT. Made it! Thanks, glad to know someone is listening. Time for 80° in MoBay!",Satisfied
I get extended hold times due to the weather...but 2-1/2 hours on hold (and counting). HELP!!,Flight Issue
- I'm currently missing a basketball game due to your lost bag policy #terribleservice #wheresmyrefund,Luggage Issue
now the 3rd issue with the plane is a fuel leak. They will let us know soon what they decide. #getmeoffthisplane #ineedabeer,Flight Issue
"flight 813 DCA to CLT stuck waiting on CLT ATC. Cmon #FAA Missing flt 826 CLT to MBJ, hope you can rebook me! 816?",Flight Issue
how long are you going make us sit in this plane while they repair it? Could I at least get a beer???,Flight Issue
so disappointed. Least you could do is give us access to admirals club for an hour before our flight to our wedding!,Flight Issue
can you please post wait time-have been on hold for two hours,Flight Issue
Saying my friend missed her flight when she clearly sat next to me on the plane &amp; now you're cancelling her flight home.. WTF!?,Flight Issue
a big thanks to the gate agent flt5127..keeping us informed of the delay#greatcustomerservice,Satisfied
DCA to RSW at 8:30am cancelled.  Rebook to Charlotte cancelled.  Can we rebook selves online???,Flight Issue
"trying 2 fly frm DCA to SRQ to visit a family member in hospice but 4532 was cancelled, can someone assist me?",Flight Issue
Sitting on the runway at phl for the last 30 min because the correct weights for the flight aren't in the system? #jobfail,Flight Issue
ok. Thank you,Satisfied
Cool. Now  has been told you can't re-route his bags after he was told to leave them last night. He needs them to race.,Luggage Issue
"quick, let's board a plane so that we can sit on runway for 2 hours #clockwork #scareways #neverfails",Flight Issue
"u would think if u were going to cancel my flight, you'd rebook our seats to something other than the last row. #usairwaysfail",Flight Issue
"Got it, thanks!",Satisfied
flight 849's four subsequent delays destroyed my travel plans this evening. Looking to resolve this matter.,Flight Issue
I did at 7 pm! Still no bag..,Luggage Issue
Just spoke with a representative. Moved my flight earlier. Thank you so much for the follow up.,Satisfied
Not only did u lose the flight plan! Now ur flight crew is FAA timed out! Thx for havin us sit on the tarmac for an hr! #Pathetic,Flight Issue
...YOU ARE DESPICABLE! The flight plan was lost! Now we've been sitting on the tarmac for an hour! Its a 45 min flight!,Flight Issue
hey guys just want to say I had the best flight ever! Thank you so much. I fell asleep and actually had a wet dream.,Satisfied
"but don't worry! They found a hotel, it's only 45min away. I got there around 11:30pm, no problem.",Satisfied
I have a story for you. It starts with a two hour delayed flight that makes me miss my connection in Miami.,Flight Issue
flight scheduled for 730pm...told at 150am that flight is cancelled after sitting on cold plane for 2 hours.,Flight Issue
How dirty does the damn plane have to be to take an hour to get the plane cleaned??? Refund me my miles😡. #wasteoftime #theworst,Flight Issue
Kudos to Robin at  Lost/Found for reuniting me w/ my iPad. She was delightful to work with!,Satisfied
experience exceptional service from Cherry at #DenverAirport.  #GreatService. #professionalism,Satisfied
"figure it out, have had 2 cancelled flights in the past week. Now coming home 2 hour delay, and cart that pulls plane just broke",Flight Issue
me too!,Satisfied
flight #3797 treatment of passengers has been atrocious - over 2 hours delay only to now deplane and given no direction,Flight Issue
you can thank supervisor Jeanine and her coworkers for the excellent customer service they provided,Satisfied
"new slogan should be ""if you don't want to arrive on time, pick us""",Flight Issue
I will send an email with details Late Flightr. Thank you for responding.,Flight Issue
Need to change div miles ticket after travel started due to weather advisory. Told not possible unless flight cancelled. AnyHelp?,Flight Issue
I was supposed to get from fresno to pittsburgh by 10pm.  Instead I'm now not getting in until 4pm... tomorrow,Flight Issue
Now the next plane had a broken seat!  My row!  Another hour delay!  #mad,Flight Issue
yes I did thank you! They did a great job turning the flight in jan !,Satisfied
connection made. Thanks again this week. #daddyshome,Satisfied
I did &amp; was told I asked to many questions. bag might still be on flight 413. Should be easy to check when it lands in Seattle.,Luggage Issue
cancelled our original flight to aruba. Now on the way home we were told we don't have seats. Never flying  again,Flight Issue
here we go again. Same flight as last week. Delayed already 45 mins. Think the 7:15 can leave PHL before 1:15 am? #waitingagain,Flight Issue
- delayed 1851. Need an extra 5 min to make 1769. Would appreciate a little help again this week.,Flight Issue
"will do.  maybe the pre-purchase meal email is because the flight is 9 min short of 3 hours, so I guess there are none offered",Flight Issue
2 bad planes &amp; 3 gate changes= lots of exercise. #travelfail let's hope this plane works. I'm tired.,Flight Issue
is there not a faster way to get me to Columbia Sc than making me stay in CLT over night after my delayed flight?,Flight Issue
thank you,Satisfied
if you get my bag from E Gate to B Gate at the Charlotte airport before my 6 pm flight (Late Flight cause of yall) I’ll ride US for life,Flight Issue
Wishing we had our luggage. 2 days now. Had to pay our way from St Thomas to San Juan. Spent extra $$$ because of this mess up.,Luggage Issue
who runs the show at the airport have a boarding pass says us airways and I have to wait in American line #yousuck,Flight Issue
Yes thank you. Appreciate u checking...,Satisfied
this is ridiculous #planebroken can't wait to board this one home 5 hours Late Flightr #neverontime #brutal #paymytab,Flight Issue
since when does a maintenance problem and missing flight crew equal delayed due to weather? I'm confused since we had sunny skies,Flight Issue
who would like to watch the video of how loyal customers are really treated while asking for an explanation for our 6 hour delay?,Flight Issue
"more lies, they said in their email we were delayed due to weather when the sky was clear in the city we were departing.",Flight Issue
"I'm enjoying my flights so far! You're doing a great job. Today's been tough, so thanks for making my flights comfortable.",Satisfied
look  has made the right call on CHO. Please evaluate. http://t.co/3KhGjoFgpX,Flight Issue
Shavon at customer service desk in Charlotte was fantastic! So helpful and smiling evn after what sounds like long day.Reward her,Satisfied
"yep, sent my bag to Philadelphia instead of Miami...I caught it...then was told my flight changed to tomorrow, wrong again #fail",Luggage Issue
"right, can you use a shuttle ticket from LGA to BOS for any shuttle flight? Probably gonna miss the 4pm.",Flight Issue
#NAME?,Satisfied
"Batting 1.000! Four flights in a month, all four delayed!",Flight Issue
"&amp; also that I was told no comps, upgrades, etc. ReFlight Booking Problems is good enough. #usairwaysfail",Flight Issue
"I was... 4 tomorrow. I missed my meeting today, &amp; it was pointless 2 pay hotel today when the purpose of my trip has been screwed",Flight Issue
"and next flight delayed as well. 5238 out of Charlotte, is it just my luck or what?",Flight Issue
Just talked to reservation. Must congratulation to them. Very friendly.  Good for usair. The ONLY airline we fly.,Satisfied
"fight was delayed 3 hrs in MCO, now I'm stuck in Philly with a standby ticket, flight 4009. Solution needed.",Flight Issue
It wasn't weather this morning.  AWE1701 diverted back to BOS due to mechanical issues.  So far lost one of 3 days :(,Flight Issue
waiting for bags now over 25min in Phl bag claim!,Luggage Issue
awesome! Flight #676 out of philly on Tuesday. Party in row 15 if you're interested.,Satisfied
i got through and am able to switch my flight with no charge. Thank you,Satisfied
"Welcome to North Texas US Air / American Air employees. 
Housing and Education are great opportunities in The GR8 State Of Texas",Satisfied
your staff at LAX really messed up on this one. Failing to scan my suitcase tag.,Luggage Issue
Not happy with start of trip!  cancelled flight #poor customerservice,Flight Issue
"Thanks. No DC yet, I see. I will keep that link and check back. Appreciate it!",Satisfied
I called the BTV desk; they had more information - so it exists.  Your systems don't make it easy for the customer to access it.,Luggage Issue
