text,category
I will be stunned if my bags are in Hartford with me.  The ORD ground crew only had an hour to move my bags 200 yards,Luggage Issue
thank you!,Satisfied
Thanks - it's very helpful to understand that the reduced price seats that are sold at check-in have priority over the certificates.,Satisfied
As a Million Miler I've been delayed plenty. NEVER in the amateurish way does it. I'd be embarrassed to be affiliated.,Flight Issue
Another delayed United flight. I should not be this surprised or upset. I'm mostly disappointed I have to cancelled my trip with my dad,Flight Issue
Thank you Margo at Houston's Bush Intercontinental for getting me home earlier.,Satisfied
my cats flight was delayed 1+hour  she will be arriving to Hawaii after 5 &amp; I won't be able to pick her up until tomorrow 😭,Flight Issue
now you've lost my bags too.  At least nobody has done anything to help out.  This is absurd.,Luggage Issue
"Thanks, but not so much the missing bag as the nonexistent staff at this apparent remote outpost (busy airport for city of ~1M).",Luggage Issue
my friend lost luggage on flight 1547. What to do?,Luggage Issue
"sweet, follow back and I'll get the dm off",Satisfied
all good! Next flight was a little delayed so it all worked 👍,Satisfied
"Nice ""partners"" you have. The delays keep increasing every 20 min   http://t.co/1AtEafnC6R",Flight Issue
UA1740 just admit you have no clue when flight will leave Denver. #unfriendlyskies,Flight Issue
Just had the worst experience ever flying with you,Flight Issue
UA1740. As the inbound flight dep time gets closer you push it back 15 min. You've been doing this for 2 hrs.,Flight Issue
why is my flight from mke to ord getting delayed? Our gate attendant is not communicating!,Flight Issue
rebooked.  This one is Late Flight too.,Flight Issue
2nd Late Flight flight today,Flight Issue
"if u miss first leg of ur flight, you have to pay hundreds of $'s just to keep your second leg? How much to keep my earned miles?",Flight Issue
Boeing 777 Star Alliance short finals  27L on an amazing winters morning #777 #Avgeek http://t.co/owMaXOyEhZ,Satisfied
I am blown away by stellar #custserv !! Thank you &lt;3 http://t.co/JOrEScfb4x,Satisfied
a good start would be  to warm the plane before the departure time so the flight isn't delayed due to frozen water lines.,Flight Issue
you have the nicest gate attendant at Newark airport gate 101 right now. Multiple delays and she is still pleasant with everyone.,Satisfied
6 hour mechanical delay...killing me,Flight Issue
every time I check a bag with your airline I'm confident I will be wearing the same clothes for 3 days.  Please prove me wrong.,Luggage Issue
. Thanks United for the no running water and Late Flight flight from Grand Rapids to Denver,Flight Issue
"Yeah, bag is on the way. As per usual.  I'm actually getting used to getting it delivered to me, its kind of nice in a sense.",Luggage Issue
LE2V9D pnr numbered flight. The first leg is cancelled due to bad weather in iatanbul. How can i make a reFlight Booking Problems,Flight Issue
"Thanks for explanation. It seems like an odd incentive structure, tho, because it dramatically diminishes the value of the certs.",Satisfied
missing this wedding because of these delays would not be cool,Flight Issue
"what do you think missing meetings is worth?  A flight voucher?  I fly all the time, so what would make it right?",Flight Issue
it's amazing really.,Satisfied
"thank you. There was one here a few months ago, but none now. Weird you don't have a club in one of the busiest airports in the US.",Satisfied
a plane took our gate and now we're just waiting in a lot at DIA,Flight Issue
my bag is a few days Late Flight to me and this is like the 3rd time in the past couple months.  Where my free miles at?!,Luggage Issue
"Flew ORD to Miami and back and  had great crew, service on both legs. THANKS",Satisfied
65 and 72 year old flying to Tokyo for vacation both with bad knees and this happens https://t.co/72RMpkOGwu,Flight Issue
no worries Your customer service gets a bad wrap but just spoke w agent who saved me huge amounts of time &amp; apologized for yesterday,Satisfied
There is no excuse for leaving a minor to spend the night sobbing (9 hours) in a plastic chair. UA's actions? Terrible. # united,Flight Issue
we have been told that it's lost...you guys don't know where it is,Luggage Issue
".: Just landed. A day Late Flight with almost no sleep, but here. I feel sorry for the woman I consoled who's mother died during the night.",Flight Issue
Thanks to supervisor Miriam who provided me with great customer service. #finally,Satisfied
Filled out at the airport as part of a long day made longer.,Luggage Issue
-today the staff @ MSP took customer service to a new level. My father passed away last night &amp; you helped me get home today! Thanks,Satisfied
"UA6255 delayed out of #winnipeg because the plane was ""frozen""! #fail Will I make my connection on UA1059? #tightconnection #Denver",Flight Issue
"delayed about 8 hours because of missed connections due to mechanical issues on 1st flight. rebooked, but please call me 9148445695",Flight Issue
.  you know your updates every 6 hours telling me you don't know where my bags are is also equally irritating. #ColtsMissingBags,Luggage Issue
you are lightyears ahead of the security control at Newark airport. They wasted 40 precious mins w bad efficiency. #frightening,Flight Issue
"Great, thank you!",Satisfied
delayed agAin by United. Gate agent was borderline rude when I asked her a flight status question. What is happening to United?,Flight Issue
Club in Denver is dope 👌,Satisfied
we are never going to get to out gate at this rate.,Flight Issue
sorry to hear outsourcing plan. Boise is best staff/cust service in the country. #boise,Satisfied
-LGA-ORD UA 711. Did not get agent name. Argument over baggage policy.,Luggage Issue
Monday evening.,Luggage Issue
"cool, thanks.",Satisfied
my baggage is in shannon now so never mind u can work on giving me some $$$ back now,Luggage Issue
that's funny because I emailed  once and they found it hadn't left LHR. In the mean time stuck with no bag in NYC!!!,Luggage Issue
"is the biggest joke of a company,I will never fly with them again! 3 days now waiting for my bag, they don't even know where it is!",Luggage Issue
why haven't you updated that flight 4411 is delayed? Super frustrating,Flight Issue
I read that last hashtag as Go F United. Makes sense since they F us by cancelledling ticketed reservations,Flight Issue
You delayed a connection for customer service today now I'll be able to pay my final respects to a dear family member. Thank you :),Satisfied
How can you not know where my bags are?  You knew where they were 6 hours ago. You are killing me!  Worst service. Ever.,Luggage Issue
"ok, I have that, pretty sure I had it before too but will wait and see what happens....",Flight Issue
What is the point of a UPC code on checked baggage if you can't tell me where my luggage is? Vacation- day 3: trying on swimsuits...,Luggage Issue
how come I have no baggage updates.,Luggage Issue
are my bags here yet?  They were at Palm Springs airport.  I was at LAX.  How come I beat my bags here.,Luggage Issue
why couldn't you have changed the tire of my delayed UA1127 flight when it arrived instead of waiting until boarding?,Flight Issue
I want my bags. There is vital equipment in there. You are royally screwing me. I'm cranky and want an update.,Luggage Issue
you guys have such big hearts.. keep up the good work,Satisfied
"I am VERY disappointed with  as your partner. No communication, 2 extremely Late Flight flights. Really, all around horrible.",Flight Issue
"missed connection, wrong city, bags at Palm Springs, but not at hotel. I am seriously tired of being treated this way.",Luggage Issue
Where are my bags!!!  They weren't in LAX like your promised.  9 out of 10 things today were a mess today because of you.,Luggage Issue
received my bag. I appreciate taking care of the matter and following up!,Satisfied
I've been waiting on my bag in IAH for 45mins.  They're only 4 freaking people on that flight waiting for bags.  Fix this!!,Luggage Issue
:take note of this great example of  actually making good for an extremely inconvenient situation. http://t.co/t3Gnk2N7LD,Satisfied
"""federal regulation prohibits you being separated from your bag""...yet you lose our bag and that's okay",Luggage Issue
we just almost had a major accident on ua3710 ... How about passing on some information to those of us waiting on plane!!!,Flight Issue
3 hour delay plus a jetway that won't move. This biz traveler is never flying u again!,Flight Issue
"That made me so mad, but then I called the bag number, and that person was helpful and told me where the bag really was. (2/2)",Satisfied
"Yes. It was the airport person who told me the bag was still in Nashville, when I filed the claim. (1/2)",Luggage Issue
The only thing you fella have done right today is get me to the pacific time zone.,Satisfied
Ugh.  My bags were sent to Palm Springs and not to LAX as promised.  They better be at the hotel when I get there.,Luggage Issue
"yup, it just happens way too often...5 times in the last 12 months",Flight Issue
so who does handle bag issues? And why wouldn't you put me onto them in the first place?,Luggage Issue
big up the pilot of 644 for turning 1hr on the tarmac to just a 20min delayed arrival,Satisfied
Holiday of a lifetime to New York ruined because you lost my luggage and have failed to find it since Sunday! #wontflyagainwithyou,Luggage Issue
once again my bag is lost when I travel united!!!! Please do something,Luggage Issue
Stuck on plane for over an hour due to mechanical faults. Any updates please? This happened on way to Newark and now again to LHR...,Flight Issue
did I mention one bag is an infant car seat &amp; we've been stuck with yr poor replacement on icy mtn roads,Luggage Issue
"I am a frequent user. Congrats u only lost my bags once in 20 years. Problem, it was today and your staff were rude!😢 still no bag!",Luggage Issue
Sivi Stewart at Lax was fantastic tonight helping to find a lost item for us at the airport.  Much thanks!,Satisfied
"Yes, though they have not located the bag yet. It was a lovely flight outside of that.",Luggage Issue
Got me home amid snow &amp; Cancelled Flightlations; delivered bag w/o hassle; plus no wait on phone &amp; an upgrade. Thank you!,Satisfied
it's messed up to refuse to wait 10 min after united is at fault for delay but to leave early is absolutely disgusting.,Flight Issue
mechanical delay occurred in Houston earlier today re: their flight to ORD,Flight Issue
"Cc   #boldflavors “: We’re bringing Bourbon St. to 35,000 ft. with bold flavors, fresh ingredients and more dining options""",Satisfied
"be  ""Chicago's hometown airline"" care about your neighbors #SaveTheDiagonals #FlyQuiet #ORDNoise",Satisfied
Give Cyndi &amp; Troy each a gold star.,Satisfied
our flight attendant  was super helpful in finding a bag we left on a flight today. Excellent customer service. Name fits.,Satisfied
3875 to Denver which we are supposed to be boarding right now but has yet to land,Flight Issue
I've been doing this for 15 years and I've never had this many issues with any other airline.,Flight Issue
haha that's fine. Still won't fly  ever again. Seems like you guys have more problems than anyone else.,Flight Issue
and they were traveling as guests of a mileage plus member using that members miles. Great customer service.,Satisfied
"Bringing your ""A"" game with premium cabin dining. Nice! https://t.co/zgOQoxjBQY",Satisfied
"fair enough, but it stinks to be the passenger on the plane that leaves the gate then sits on the tarmac for an hour before takeoff",Flight Issue
they held the flight for our group of nearly 20 people.,Flight Issue
you guys suck. You delay flights but can't hold the connectors 10 minutes??? #WorstAirlineEver,Flight Issue
"time for a rant...you delayed my flight and still forgot my luggage...then delayed on the Tarmac, moments I love you United",Flight Issue
- I think she was having a rough moment w/ a bad passenger from an earlier flight. Things got considerably better. Thanks!,Satisfied
"awesome. Thx. And thx for replying so damn fast, sure as hell beats 80s cheeze hold music!!",Satisfied
$55 cab ride to dfw from love got me my bag. Reimburse?,Luggage Issue
thanks for not getting my BusinessFirst priority tagged bag onto my connecting flight at EWR despite a 2+ hour layover. Nice job,Satisfied
"amazing flying over 25,000 miles on #UnitedAirlines &amp; alliance last year; still got jilted out of status! #moneyelsewhere",Satisfied
now finally in memphis. Landed 30 minutes ago. Still no bags. Paying for a service that just gets worse...,Luggage Issue
"She met me from customer service at the arrival of flight UA3787 PVD-IAD. Thanks, you guys have really handled this storm!",Satisfied
ooh thanks!,Satisfied
"my flight was at 1 pm. Still at the airport gee what service.  Do they care, nope.  Delayed until 7:55.",Flight Issue
": I feel very well informed. yes, the flight is indeed delayed. Thank you. http://t.co/FuCHZRZjg5",Flight Issue
thanks for all the help! Totally appreciate it and you made it super easy too,Satisfied
$7 for wifi just so I can tell my family I'm gonna be Late Flight cause i had to sit in a grounded plane for the past two hours...,Flight Issue
FYI: continuous texts and emails I am getting about the delay while held captive on the tarmac are not that helpful.,Flight Issue
: No friendly skies from you today. 5hr+ weather delay in SFO followed by 1hr+ mechanical delay while sitting on plane. #NoFun,Flight Issue
thanks! :),Satisfied
I shouldn't have to spend my own $$$ on a hotel because of a weather delay. The weather being something COMPLETELY OUT OF MY CONTROL,Flight Issue
eventually.  You should approach bags like   they get it.,Luggage Issue
What if my NYC flight is delayed and I miss my connection to Sacramento from Chicago?,Flight Issue
don't check your baggage if you don't have to.  They will lose it!,Luggage Issue
I'm hoping we don't miss our LAX - ITO connection. Not looking forward to being stuck at LAX overnight with our team....AGAIN!,Flight Issue
"how can you not know, after two hours of us sitting on the plane with no bags off loaded, the planes weight?!",Flight Issue
You make it hard to fly with you. Delayed over an hour and now the plane  is turning around &amp; heading back to the gate. #connection?,Flight Issue
if our already rescheduled flight is cancelled is our hotel room paid for?,Flight Issue
Elizabeth at Washington Dulles just hooked me up with a new connecting flight at my gate! I'm super pleased!,Satisfied
Thanks!,Satisfied
flight UA3364 been sitting on tarmac for 30 mins with no report as to why...any input?,Flight Issue
stuck here in IAH waiting on flight 253 to Honolulu for 7 hours due to maintenance issues. Could we have gotten a new plane!?!? Fail,Flight Issue
JT thanks for your help I’ll complete the form once we are back home,Satisfied
You might be dealing with frustrated passenegers. hope you all have a great day :) thank you very much for an amazing airline :),Satisfied
yes still need assistance I don't have a flight home due to change in flight u made I miss all connections !,Flight Issue
"My flight UA1159 to Denver for #RMOUG15 has been re-cheduled 5 times.
If I am no show, you'll know why! Ridiculous.",Flight Issue
"here I was thinking how I could say so many nice things after getting upgraded, but then you delayed my flight... It's ok!",Flight Issue
thank you! I wish the lady in Little Rock had told me that in the morning when I asked her,Satisfied
no claim number. Haven't been back to iAd baggage since. Is there a phone I can call to speak to someone?,Luggage Issue
"Thank you for the speedy response! I figured it may be something of that nature. You guys and your ""fine print,"" haha",Satisfied
holy high speed internet batman!  Speeds at United Club at IAD are insanely fast!  Thanks,Satisfied
Flt 4487 is having some MAJOR delays bc ground crew was so SLOW. The flight crew has been terrific. Been 2 hours on the ground..😡...,Flight Issue
"sorry, I hate united. i won't get to see my family until Thursday",Flight Issue
Thanks for the timely service &amp; great staff getting my wife and me to and from Cancun this past week for our honeymoon.,Satisfied
"done just now, thanks.",Satisfied
"thanks for the offer, but I finally made it to my destination, albeit hours Late Flight.",Flight Issue
Airlines cancelleds OC FLL #flight today. $700 to switch. No notice no apology. We are done flying #UnitedAirlines.,Flight Issue
I travel a lot and I get it. You're still my fave but EWR to Cleveland w/40 min layover to connect to DC = our best option? Come on.,Flight Issue
"3pm and my bags still not here. not even a courtesy toiletries kit. not the flight experience I was expecting, very disappointed.",Luggage Issue
Airlines cancelleds OC FLL #flight today. $700 to switch. No notice no apology. Done flying #UnitedAirlines.,Flight Issue
thank you! 😊,Satisfied
3359 which you finally cancelled.,Flight Issue
thanks finally made it.. Missed meetings but what can I do now?,Flight Issue
Our flight was originally supposed to leave at 1:40pm &amp; now we won't leave until 5. This is the 2nd time this has happened,Flight Issue
"Supposedly, they're out for delivery. I'll believe it when I see it.",Luggage Issue
Sure did! Only waited about 15min. Yay!,Satisfied
"Hi JH, my experience with United has been entirely disgusting but yes, I'd like assistance in getting compensated for my bag.",Luggage Issue
took this picture on Thursday. #awesome http://t.co/IVGpZSjtkW,Satisfied
Is expiring the  offer to buy or transfer #United #MileagePlus miles with discount? Many offers during a year http://t.co/6tz6imqZlG,Satisfied
"no, it was 2 flight cancelledlations (one due to weather, one mechanical) paid own hotel, bag held in transfer. No voucher/compensation",Flight Issue
i got email that my reservations got cancelled and i will be refunded.  Nothing got refunded as of yet,Flight Issue
So what do you offer now that my flight was cancelleded and I'm stranded away from home and work?,Flight Issue
looks like I'm settled in to where I'm going.  Thx.,Satisfied
Stuck in IAD going on 6 hours waiting for a ferry flight from Nashville that u can't tell when it will arrive?!! Ridiculous!!,Flight Issue
"Thanks, ^KP. Please also mention the Quiche breakfast and Tandoori chicken dinner entrees and accompaniments are truly First Class.",Satisfied
flt. 4567 departure time has changed five times in the last 20 minutes. Why don't you figure out a solution and announce once?,Flight Issue
bags are still in Houston since Friday and still have not been reimbursed the baggage fee.,Luggage Issue
who can tell me where they are?,Luggage Issue
"flight 4567 have already been cancelled once, been trying to get home two days. Staff being very unhelpful.",Flight Issue
thanks kp but luckily my transfer has maintenance issues and is still delayed so I didn't miss my transfer...,Flight Issue
"I'm not this person, but I've been sitting in Denver for three hours and all I want to do is get on a plane. Please let me go home.",Flight Issue
flight 441 on 2/4 was delayed over three hours because the pilot never showed up!,Flight Issue
I just need to get to RIC tonight. I've been in EWR for 24hrs now.,Flight Issue
45 minutes after arrival and no bags for most people. UA469 from den to ewr. How long should we wait until a ual rep comes here?,Luggage Issue
"on a good note, the 2 employees I encountered @ Newark were fabulous. I was very Late Flight for my connecting flight and they got me on!!!",Satisfied
u lost my bag and would not refund my bag fee? Does that make sense to you? And yes I already called cust svc. They said no.,Luggage Issue
"doing a good thing, holding flight for a few for 11 peeps on Late Flight connecting flight. We'll still make destination on time",Satisfied
stay warm - I will be passing through Chicago next week,Satisfied
Only at Newark can you land 15 minutes early but lose all that time waiting on tarmac for a gate.,Flight Issue
Nearly 48 hours Late Flightr and still no idea where it is. I will never fly United again if I can help it.,Luggage Issue
WiFi onboard 737-800 far superior in pricing and performance (user-perceived bandwidth and Late Flightncy) to recent  experiences.,Satisfied
Second day &amp; attempt trying to leave IAD &amp; I'm on another plane delayed for mechanical issues. Over an hour delayed!,Flight Issue
when is my plane coming?  Been delayed for almost 7 hours. No plane.,Flight Issue
thankful for great service in Newark. Seats fixed and I was seated with my daughter! Fab landing in Fort Myers!,Satisfied
my mother's flight was delayed from phl-ord. We're on our way to NRT and the gate refused to upgrade. A platinum.  Blegh,Flight Issue
is Late Flight again.  Everyone braved the weather and 40 passengers are waiting for a flight crew.  Really!,Flight Issue
Miserable trip ... lost bag Sat... found Mon... lost again... shipping 2nd day ground Tues... might have it for return flight home,Luggage Issue
Brandi Zabsonre in Denver deserves a raise for bringing delight into a terrible travel situation. big ups http://t.co/TK3aOpdtSQ,Satisfied
"you better hold my flight to Tucson #5237, just landed in Houston after an hour delay for some minor computer problem",Flight Issue
feck guys. Stop cancelledling flights from EWR to RIC the weather is fine I both locations!!!,Flight Issue
"pleasantly surprised to find ANA has made major upgrades on their transpacific route in flights, planes and service",Satisfied
Step 1: cancelled flight. Step 2: Don't notify customer. Step 3: Charge them for food while they try to survive their wait. Brilliant.,Flight Issue
. we rebooked. But  and I had to split up and take different flights because a pilot ran out of hours? Frustrating.,Flight Issue
"no worries about the tweets. We all should do what we can to make sure we, as in your tag line, ""Fly the Friendly Skies.""",Satisfied
I am thankful to the  United ground staff who put me in the last seat on the last flight out. Home Late Flight is still home!,Satisfied
I appreciate the follow up.,Satisfied
sat at airport for 5 hrs still sitting at gate..  Sigh,Flight Issue
Gold Star for united- change my flight- miss all connections- but can't accommodate me until a MUCH Late Flightr arrival time-Not HAPPY!,Flight Issue
Thank you for the new Club at O'Hare. Very comfortable. You made the difficult weather days proficient and enjoyable.,Satisfied
did not let me get on the IAH-HNL direct. Now weather delay for my SFO leg. Stop being reactive and be proactive!,Flight Issue
. call my work and tell them it's your fault I'm Late Flight,Flight Issue
"New Apple crâpe, amazing! Live from UA1207. Really nice crew too.  #AmericanAir has biscuits, UA needs them 2 http://t.co/gZ9GqDT7Jj",Satisfied
"is officially the worst, most delayed, and least helpful airline I have ever had the misfortune of flying on",Flight Issue
i have items of sentimental value that I'm heartbroken are missing,Luggage Issue
I like delays less than you because I'm the one on the plane. Connect me with a voucher,Flight Issue
"the we got into the gate at IAH on time and have given our seats and closed the flight. If you know people is arriving, have to wait",Flight Issue
yes. We waited in line for almost an hour to do so. Some passengers just left not wanting to wait past 1am.,Flight Issue
although I'm not happy you cancelleded my flight home tomorrow (phx to atl then dca) I am happy on how easy it was to rebook,Flight Issue
my flight was delayed 4 hrs. I'm 5 months pregnant &amp; supposed to be caring for my mom whose in surgery now. Very upset.,Flight Issue
thank you so much completely made things right!,Satisfied
love them! Always get the best deals!,Satisfied
thx. Make it right. Help Meagan Fouty Brancato fl#2771 dfw gate 4 preboard w/kids - b4 group A please. Please.,Satisfied
thanks Southwest for saving our trip. my sweetheart isn't going to miss seeing #AltonBrownLive thanks to y'all! #SOhappy,Satisfied
"never mind, I moved my flight to tomorrow. Thanks for the help!",Satisfied
I managed to get sorted out over the phone. Good luck dealing with the snow in Texas!,Satisfied
oh look you just delayed our flight an additional half hour now arriving at 6 officially five hours after planned. 😡😡😡😡😤😤😤,Flight Issue
weather bc of system outage. Hopefully everything goes smoothly now. Thank you for follow up,Satisfied
they were moved to the 210pm flight #4649. Main concern now is luggage arriving with them. They were told that SW was having,Luggage Issue
I USED to always fly Southwest.,Satisfied
got my bags 35 hours Late Flightr and an offer of $50 to go pick them up. Taxi costs $65 one way. Spent $200 for the inconvenience.,Luggage Issue
"THANK YOU for your awesome flights. Sweetheart got screwed on , managed to scramble and get a SW plane today. !!!",Satisfied
Thanks so much!,Satisfied
round-trip tickets just arrived for our auction at the Post-Masters Invitational! Thanks Southwest! http://t.co/mRfBjtePef,Satisfied
tv stream means I get to spend my flight watching 1999 and 2011 Women's World Cup Finals. #throwback #bestflightever,Satisfied
I'd at least enjoy a free cocktail...or two.,Satisfied
I agree! RT : One airline is the fly-away favorite at DIA  #9NEWSBusiness http://t.co/o3WlaInImY,Satisfied
its flight #218 of that matters to you all. Hell next we all won't get our luggage properly transferred #facepalm #smh,Luggage Issue
