text,category
plus you've added commercials to the experience... tacky.,Satisfied
"yes, nearly every time I fly VX this “ear worm” won’t go away :)",Satisfied
"Well, I didn't…but NOW I DO! :-D",Satisfied
"it was amazing, and arrived an hour early. You're too good to me.",Satisfied
I &lt;3 pretty graphics. so much better than minimal iconography. :D,Satisfied
This is such a great deal! Already thinking about my 2nd trip to  &amp; I haven't even gone on my 1st trip yet! ;p,Satisfied
I'm flying your #fabulous #Seductive skies again! U take all the #stress away from travel http://t.co/ahlXHhKiyn,Satisfied
Thanks!,Satisfied
SFO-PDX schedule is still MIA.,Flight Issue
So excited for my first cross country flight LAX to MCO I've heard nothing but great things about Virgin America. #29DaysToGo,Satisfied
I ❤️ flying . ☺️👍,Satisfied
you know what would be amazingly awesome? BOS-FLL PLEASE!!!!!!! I want to fly with only you.,Satisfied
I love this graphic. http://t.co/UT5GrRwAaA,Satisfied
I love the hipster innovation. You are a feel good brand.,Satisfied
this is great news!  America could start flights to Hawaii by end of year http://t.co/r8p2Zy3fe4 via,Satisfied
Moodlighting is the only way to fly! Best experience EVER! Cool and calming. 💜✈ #MoodlitMonday,Satisfied
"Done and done! Best airline around, hands down!",Satisfied
"View of downtown Los Angeles, the Hollywood Sign, and beyond that rain in the mountains! http://t.co/Dw5nf0ibtr",Satisfied
I'm #elevategold for a good reason: you rock!!,Satisfied
wow this just blew my mind,Satisfied
Julie Andrews all the way though  was very impressive! NO to,Satisfied
you know it. Need it on my spotify stat #guiltypleasures,Satisfied
I'm Lady Gaga!!! She is amazing! 😊,Satisfied
love all three but you really can't beat the classics!,Satisfied
"Hi, Virgin! I'm on hold for 40-50 minutes -- are there any earlier flights from LA to NYC tonight; earlier than 11:50pm?",Flight Issue
Congrats on winning the  award for Best Deals from an Airline (US) http://t.co/kj1iljaebV,Satisfied
everything was fine until you lost my bag,Luggage Issue
"not worried, it's been a great ride in a new plane with great crew. All airlines should be like this.",Satisfied
awesome. I flew yall Sat morning. Any way we can correct my bill ?,Satisfied
I've applied more then once to be a member of the #inflight crew team...Im 100% interested. #flightattendant #dreampath -G,Satisfied
you're the best!! Whenever I (begrudgingly) use any other airline I'm delayed and Late Flight :(,Flight Issue
I like the TV and interesting video . Just disappointed in cancelled flight when other flights went out to jfk on Saturday .,Flight Issue
"just landed in LAX, an hour after I should of been here. Your no Late Flight bag check is not business travel friendly #nomorevirgin",Flight Issue
why must a traveler miss a flight to Late Flight check a bag?  I missed my morning appointments and you lost my business. #sfo2lax,Flight Issue
how's a direct flight FLL-&gt;SFO have unexpected layover in Vegas 4 fuel yet peeps next to me bought for Vegas flight. #sneaky,Flight Issue
your no Late Flight bag check just lost you my business. I missed flight and AM apt. Three other people on flight had same exp.,Flight Issue
"- amazing customer  service, again! 💕💕 RaeAnn in SF - she's the best! #customerservice #virginamerica #flying",Satisfied
"has getaway deals through May, from $59 one-way. Lots of cool cities http://t.co/tZZJhuIbCH #CheapFlights #FareCompare",Satisfied
"has getaway deals through May, from $59 one-way. Lots of cool cities http://t.co/B2Xi4YG5T8 #CheapFlights #FareCompare",Satisfied
Have a great week 🌞✈,Satisfied
come back to #PHL already. We need you to take us out of this horrible cold. #pleasecomeback http://t.co/gLXFwP6nQH,Satisfied
"should I be concerned that I am about to fly on a plane that needs to be delayed due to a ""tech stop""?",Flight Issue
"is the best airline I have flown on.Easy to change your reservation,helpful representatives &amp; a comfortable flying experience",Satisfied
and again! Another rep kicked butt! Naelah represents your team so beautifully!! Thank you!!!,Satisfied
your beautiful front-end design is down right now; but it was cool to still book my ticket b/c all your back-end was secure.,Satisfied
"Love the team running Gate E9 at LAS tonight. Waited for a delayed flight, and they kept things entertaining",Satisfied
thanks to your outstanding NYC-JFK crew who moved mountains to get me home to San Francisco tonight!,Satisfied
you have the absolute best team and customer service ever.  Every time I fly with you I'm delighted.  Thank you!,Satisfied
completely awesome experience last month BOS-LAS nonstop. Thanks for such an awesome flight and depart time. #VAbeatsJblue,Satisfied
your assistance yesterday when u cancelled our flight was to give us a hotel hotline  Shame on you!,Flight Issue
Another delayed flight? #likingyoulessandless,Flight Issue
you ROCK for making it so I can watch #Oscars on my flight!! #redcarpet #oscars #oscars2015,Satisfied
always!!! Xoxo,Satisfied
best customer service rep in the world! #irmafromDallas takes the cake!!!,Satisfied
please provide status for flight 769.  I cant imagine it's on time as the Web indicates  dude to weather here and/or Dallas,Flight Issue
you have amazing staff &amp; super helpful as I just ran the  #PrincessHalf they have spoiled me with comfort!!!,Satisfied
"I paid the premium to fly you across the country, you cancelled my flight and offer no check fee or upgrade love? Sad face :(",Flight Issue
Always have it together!!! You're welcome! RT :  You're so welcome.,Satisfied
#flight home to #dc #sunset #globe in' #backtowinter back to #work! #refreshed http://t.co/VX9vBCTdLf,Satisfied
thank you for checking in. tickets are purchased and customer is happy ;-),Satisfied
How do I reschedule my cancelled flights online? The change button is greyed out!,Flight Issue
"got a flight (we were told) for 4:50 today..,checked my email and its for 4;50 TOMORROW. This is unacceptable.",Flight Issue
"our flight into lga was cancelleded. We're stuck in Dallas. I called to reschedule, told I could get a flight for today...(1/2)",Flight Issue
Thank you for the follow,Satisfied
shame on VA for making people spend money in stranded cities when other airlines are landing at JFK! Who will reimburse me?,Flight Issue
Flight from BOS &gt; LAS tomorrow was cancelled. No notification; wait times are 1+ hour. Will you rebook on another airline?,Flight Issue
😎 RT : You’ve met your match. Got status on another airline? Upgrade (+restr): http://t.co/RHKaMx9VF5. http://t.co/PYalebgkJt,Satisfied
Only way to fly! #Elevate #Gold,Satisfied
you will match my #AmericanAirlines status? Cool!,Satisfied
thanks!,Satisfied
Because we never rec'd cancellation notice we were left w no options to fly out of PS. Driving to LA for a red eye Mon w kids,Flight Issue
You have any flights flying into Boston tomorrow? I need to be home and you cancelled my flight and didn't do anything,Flight Issue
you stink. Flight cancelleded from PSP to JFK and no notification or ability to rebook #disappointed.  #expected better,Flight Issue
I love your guy's song! We're dancing to it for our high school dance revue,Satisfied
"done! Thank you for the quick response, apparently faster than sitting on hold ;)",Satisfied
cool picture of another VirginAmerica plane off our wing. What a site! http://t.co/5B2agFd8c4,Satisfied
Keep up the great work :),Satisfied
my goodness your people  field are amazing under pressure ❤️from Texas #beatstheothers in crisis Please fly me to NY,Satisfied
Thanks for a great flight from LA to Boston! Pilots did a great job landing in the snow. Can we go back to LA now? #seriously,Satisfied
"Thanks so much for the awesome support, you guys rock!",Satisfied
flight 404 delayed 2 hours in LA due to mechanical problems. Handle like pros but you could have tossed us a free drink.,Flight Issue
why cancelled flights today? No precipitation to be scared of!  ❄️❄️❄️,Flight Issue
twitter team. you guys killed it for rescheduling me asap. thank you!,Satisfied
You guys charged me $100 to reschedule a flight that was then cancelled and are now refusing to refund it. What's the deal?,Flight Issue
I was really looking forward to my flight. can you let me know when it will be rescheduled? #diehardvirgin,Flight Issue
"why cancelled flight VX413? One sec its delayed, on my to airport, the next its cancelled?Gonna email or call me to reschedule?",Flight Issue
I was so looking forward to my first flight with you today but it was cancelled along with the subsequent one ...,Flight Issue
when are you putting some great deals from PDX to LAS or from LAS to PDX show me your love! http://t.co/enIQg0buzj,Satisfied
wish I can afford to fly with you next Friday  going back home.. love everything  about your airline,Satisfied
Like http://t.co/VPqEm31XUQ,Satisfied
You have the best flight attendant ever!!! http://t.co/PxdEL1nq3l,Satisfied
"Awesome! RT : Watch nominated films at 35,000 feet. #MeetTheFleet #Oscars http://t.co/DnStITRzWy",Satisfied
thanks so much!,Satisfied
", the only airline based in Silicon Valley! #disruption #FCmostinnovative #incubator  's http://t.co/wU3LbCNcr9",Satisfied
Very nicely done. 👏,Satisfied
I’m looking forward to watching the Oscars on my flight home tomorrow. I might even get something bubbly to drink! ;),Satisfied
What is the reason  for the delay of the departure of VX 413 from JFK this afternoon?,Flight Issue
"is todays flight from Palm Springs, Ca to JFK in NY cancelled?",Flight Issue
hahaha 😂 YOU GUYS ARE AMAZING. I LOVE YOU GUYS!!!💗,Satisfied
sounds like fun !,Satisfied
"We're on flight 910 Vegas to Boston today, checked in online but our bag count didn't register. Can I fix that somehow?",Luggage Issue
"classiq, luv Virgin America. Greetingz",Satisfied
Thanks for your great customer service today &amp; for helping me get all my travel sorted out!,Satisfied
thanks guys! Sweet route over the Rockies #airplanemodewason,Satisfied
love the 90s music blasting at gate in #Boston while waiting for flight to #SanFrancisco. Only if I could get an iced coffee!,Satisfied
"thank you for the easy itinerary shift for impending weather. Quick, painless &amp; free.",Satisfied
Thanks! Good times there and back! #Vodkatonics the entire flight🍸#sfo,Satisfied
", you're doing a great job adding little luxuries/aesthetics that improve the air travel experience. Thank you. Keep it up!",Satisfied
thanks for gate checking my baggage on your full flight dfw-lax 883 and giving me early boarding too #sweet,Satisfied
I see what you did there ;),Satisfied
your inflight team makes the experience #amazing!,Satisfied
cutest salt and pepper shaker ever. Just when I think you guys can't get any better you just do! http://t.co/vC6Keulg2J,Satisfied
fav airline,Satisfied
we have a hot female pilot! Sweet! DCA to SFO! :-),Satisfied
already contacted Central Baggage &amp; sent DM.  is charging me for the dress that was in the lost suitcase #help,Luggage Issue
Thank you!!,Satisfied
would love to do more for virgin just like I do for,Satisfied
loved it. Can't wait for Monday's return flight... Mostly just to watch the inflight safety video again. #sorrynotsorry,Satisfied
"lost my luggage 4 days ago on flight VX 112 from LAX to IAD &amp; I'm calling every day, no response.Please give me back my stuff",Luggage Issue
Hi! Just wanted to see if you have any new routes planned this year for Newark. Love flying you guys and hope to do so more!,Satisfied
"I mean. Probably inappropriate while on board.. But, it's on!",Satisfied
happy to spend the day together. Let's do this!,Satisfied
. They were very understanding and helped me out.  Thx! #Comps,Satisfied
thank you! I absolutely will 😎,Satisfied
How about some free drinks on the flight back for the free promo?,Satisfied
thanks!,Satisfied
"my luggage is gone. I've filed my paperwork, promised a call/email. Still no resolution or response from central luggage.",Luggage Issue
Thanks!,Satisfied
thanks for taking care of  on her flight!! #rockstars #travel,Satisfied
Thanks for the lovely soft views! #travel #SAN to #SFO http://t.co/CnctL7G1ef,Satisfied
"I adore you, and am so looking forward to my flight to Austin in two weeks.",Satisfied
I was so glad it was mentioned. I took my first virgin flight a few years back and it was a transformative experience.,Satisfied
"spending my birthday night with you, DAL-DCA. Get me home!",Flight Issue
"first time flying Virgin, went to #SanFrancisco .Thanks for the smooth ride. Easily my new fav airline!",Satisfied
"just promoting the product is all, had a problem with southwest and recommend noneother than the best! http://t.co/tFaNXBh1Cf",Satisfied
"love you guys, but pls get some direct routes LAS to AUS!",Satisfied
of course! I work for  and I'm obsessed with the entire Virgin family!!,Satisfied
ok! first time flying with you tonight :),Satisfied
got it squared away. Someone picked up as soon as I tweeted. Should have tweeted sooner. 😉,Satisfied
delayed to10.30!!,Flight Issue
“:  Of course. Have fun celebrating!” Thanks! Happy Chinese New Year!,Satisfied
Flight Booking Problems last second flight for next week from SFO- to SAN any chance you want to gift me a promo code since I love you guys,Satisfied
"For my Grandma Ella's 80th, she would &lt;3 a bday greeting from your flight crew! She was a stewardess for Eastern Airlines.",Satisfied
Just bought tix for ATX - Dallas route - thanks for adding that! Love yr airline &amp; yr website is BEST transactional site EVER,Satisfied
gave a credit for my Late Flight flight yesterday. Great service !!!! That's a Wow moment! Unexpected gesture!,Satisfied
had me at their safety video . . . http://t.co/CqMm7nuE9m  LOVED my first cross country flight. #livewelltraveled #sytycd,Satisfied
that doesn't look to fat to me! It looks yummy!,Satisfied
omg omg😍😍 nonstop Dallas to Austin on virgin✨😱✈️,Satisfied
Your planes are really pretty. Just thought u should know that. :),Satisfied
thank you,Satisfied
good to be home #texas #moodlighting http://t.co/N3BVZTY3zI,Satisfied
"thanks for that. Been needing a way to make those Austin trips from DCA, and now you've come through!",Satisfied
this is too cool!  Never been on ur planes but now I will!!,Satisfied
great. Well deserved.,Satisfied
got it. All set - Thanks!,Satisfied
Giants and Virgin America. A match made in heaven.,Satisfied
"thank goodness!! Also, see you friday, nwk&gt;sf.. BOOM!",Satisfied
I luv ur people and product! 1 thing is y do u charge for herbal tea but not black tea? I'm not a caffeine drinker,Satisfied
thank you! See y'all soon! I'm excited to see the expansion of destinations. Spread those wings!,Satisfied
has the most INCREDIBLE customer service I've ever experienced! So refreshing!,Satisfied
", am I dreaming? Did you really just open up a route between Dallas and Austin?! And does this mean Houston might be next?",Satisfied
OMG FINALLY,Satisfied
#thankyou the DAL-AUS route makes my day!!!!,Satisfied
awesome deals DAL-AUS for only $39 each way! https://t.co/xCVQXYkg49,Satisfied
"love it, taking  on in their backyard! Consumers win when biz competes.",Satisfied
​ is flying from Love to Austin now. That is most excellent news.,Satisfied
Congrats VX on the new route! ✈️🎉,Satisfied
"I tried that. You offered to charge me an additional $1k for a new ticket or be stranded until Thurs. 1st time, last time.",Flight Issue
I am all about the in flight artisanal cheese and wine pairing.,Satisfied
That's classy.,Satisfied
I'm sure a lot of your 747 and 777 JFK-LHR flights go a lot faster than 513mph with a strong tailwind.,Satisfied
now it's just t-minus 32 minutes until my Elevate a Silver upgrade window opens . #FreeNeverSucks 😃👍,Satisfied
Why is it taking 12 years to fly home to Dallas? Get your shit together.,Flight Issue
would have been a rough trip but LUCKILY we were on a #virginamerica flight. #weather,Satisfied
"another perfect flight.   How come on your planes,  the sun visors can stay down?  Other carriers make you raise them?",Satisfied
"Nice RT : The man of steel might be faster, but we have WiFi – just saying. #ScienceBehindTheExperience http://t.co/FGRbpAZSiX",Satisfied
I love the dancing little richard. cool beans.,Satisfied
I don’t use Passbook =/ I still love you though &lt;3 :) I’ll just use my email in the future.,Satisfied
thanks for the free birthday points! y'all are ALL RIGHT with me!,Satisfied
thanks so much for sharing. Just added it to my site http://t.co/TsviBTvT8h,Satisfied
Dad on Segway is the best part of this whole infographic!,Satisfied
Are there any plans for a short haul airline in Europe? Would defiantly fly with you guys :),Satisfied
wifi AND better seating.,Satisfied
". not only was it great, but you return my calls the day after. Couldn't ask for more. #myVXexperience",Satisfied
"While other airlines weren't cancelleding flights into BOS, and helping their customers get home, Virgin was saying Good luck!",Flight Issue
"so loyal that I'm driving to #NYC from #PA, to fly Virgin,  since you cut #Philly flights ;)",Satisfied
you guys are perfect as always! &lt;3 #WeRVirgin,Satisfied
thanks! Y'all have some of the best customer service left in the industry.,Satisfied
really wish you'd fly out of #Fargo  those fares are amazings,Satisfied
my flight (6000) scheduled for 1pm departure still says on time but no plane at gate. Any update on how long of a delay?,Flight Issue
just got on the 1pm in Newark home to LA. Your folks at EWR are incredible #letsgohome,Satisfied
Flying LAX to SFO and after looking at the awesome movie lineup I actually wish I was on a long haul.,Satisfied
thanks,Satisfied
Thanks for taking care of that MR!! Happy customer.,Satisfied
still no refund or word via DM. Please resolve this issue as your cancelled flight was useless to my assistant's trip.,Flight Issue
Delayed due to lack of crew and now delayed again because there's a long line for deicing... Still need to improve service #united,Flight Issue
thanks -- we filled it out. How's our luck with this? Is it common?,Satisfied
thanks,Satisfied
Thanks. It is on the same ticket.,Satisfied
follow me please this airline is beautifull ♥,Satisfied
"if the car seat is lost  should just reimburse me for a new one, this is not a pair of shoes, it's a necessity for my child",Luggage Issue
just wanted to let you know how wonderful Rosetta the gate agent was working flight 6457 Dan to Ase. Let her know she wasappreciated,Satisfied
"See? We were told repeatedly that the pilot was Late Flight and kept getting Late Flightr.  After we boarded, there was a defibrillator issue.",Flight Issue
"- thanks for your help...got me what I need, but its an issue with  . I guess I sit awhile longer.",Satisfied
A refund and flight vouchers or another flight on a different airline at your expense for today. 8 hour drive is very inconvenient,Flight Issue
then why have I not received my call back its been 3 days...it's an infant car seat how am I supposed to go anywhere with my child,Luggage Issue
well sitting on the ground 'on time' but waiting for a gate....again #tiredofthis,Flight Issue
"""Airport snow removal method #22...""
Keep up the good work folks, this is where Cessna's become 747's! http://t.co/9v8tMUsJvU",Satisfied
A measly $50 e-certificate is not how you appreciate loyal customers after they wait 3hrs on the tarmac during UA1116. #unacceptable,Flight Issue
Thank you for that. Am I able to claim any interim expenses or is the cost of the stuff up on me?,Satisfied
just flew to #TelAviv paid $100 from a third suitcase which didn't even make it on the plane! Besides for the impolite service...,Luggage Issue
My bag is still in Colo Springs. I am disabled and have to search an unfamiliar airport and look for my bag. Not a good outcome,Luggage Issue
ZCC82U cancelled flight 16h in advance??? Need connect flight reschedule so the link isn't helping. Help!? Gf waited months to see me.,Flight Issue
"in addition, my first flight was delayed an hour and I'm arriving at my destination 8 hrs Late Flight.",Flight Issue
I flew United last month and the experience was AWESOME!,Satisfied
"441, which also had 1 working WC in coach. Good thing this bird landed ahead of schedule. I have to use the WC stat.",Satisfied
they helped me at the baggage service desk.  Said bc TSA screening was down in FLL not all bags made it but bag will be in EWR @ 12,Luggage Issue
for the record- Rozana at Newark was lovely and helpful. #choosekind,Satisfied
thx for update,Satisfied
I tried but no one was available in bogota and everyone was rude in Houston. I was stuck for 35 hours because of you guys,Flight Issue
despite my bag not making it to Newark good informative email tracking updates help!,Satisfied
. What's going on with UA 236?  outbound flight last thurs was delayed 4hrs How long will this delay be? #worst2unitedflightsever,Flight Issue
#worst2unitedflightsever UA1429 IAD to LAS 2/19 mechanical problems - switched aircraft delayed 3.5 hours!,Flight Issue
"Wow. What a deal. Again, 30+ plus seats available. Easy change to make a customer happy.",Satisfied
ua1673 still waiting! Supposed to depart 9:08,Flight Issue
"I received 1 bag last night, I am still missing the other one.",Luggage Issue
2nd flight also delayed no pilots! But they boarded is so we can just sit here! #scheduling,Flight Issue
what time? Who can I call. I need my skis. I will go to the airport and get them. No more faith in United.,Luggage Issue
Yeah sorry but there's always a problem with United. And you have an international reputation for having problems.,Flight Issue
So they didn't drop my bag overnight &amp; now I'm leaving for a week. This is why you were supposed to hold on to the bag....,Luggage Issue
"I've sent the message, let me know if you got it. I'm not very twitter-literate. Also, is he REALLY going to be stuck for 18hrs?",Flight Issue
private jet would have been cool! Do does not work. I'll try again,Satisfied
common!! keep your paper work ready and don't delay our flights(#1585)and meetings,Flight Issue
"yep that's correct, I got an email at 12:30 am that the flight was cancelled, doesn't matter now flight into atl is delayed, thx",Flight Issue
1k and had problem getting out of FLL to IAH  sent DM to you about making my connection  please let me know,Flight Issue
"thanks, just sent :)",Satisfied
"I'm grounded in Montreal with ua3659. I am missing my connection ua3417 to St. Louis. Can you help,Do you have a private jet for me?",Flight Issue
how does it get cancelled 10 hours before take off?,Flight Issue
"has unrivalled access to #California with flights to the U.S. from 7 UK airports, with nonstop or one-stop connections year-round",Satisfied
checking to see why flight 3466 (atl-ord) got cancelleded?,Flight Issue
thnx for the info,Satisfied
"ok. To top things off, you've lost my luggage. Could you get ANY worse??? #UnitedAirlines",Luggage Issue
kudos for not Cancelled Flightling flights from DFW this morning.   United usually first to panic...,Satisfied
flight delayed-no one remembered to turn the heat on flight 559 leaving ORD-seriously???,Flight Issue
another awesome new plane flight 1584 and extremely nice Captain Steve Connolly.,Satisfied
did  bags make it on the flight out of iad? second day without clothes is pretty inconvenient. We're pretty curious #UnitedAirlines,Luggage Issue
Every United flight between Saipan and Guam is an adventure! You never know when 's old plane will be operational :),Satisfied
did our bags leave Washington yet? That would be convenient seeing as we left there a day ago. #UnitedAirlines #lostluggage,Luggage Issue
about 3 hours ago. I need to work out if my bag can make it to my hotel here in time or if it will need to go elsewhere.,Luggage Issue
Thanks for remembering to load my bag onto my connecting flight. Oh wait you forgot. Iceland should be fun with no clothes....,Luggage Issue
Thank you for the cheese platter and abundance of entertainment options. Time just flew by.,Satisfied
it was UA flight 1001! Now I'm currently stuck in Portland because I missed my ride because of the 3 hour delay. #GetMartyHome,Flight Issue
how we looking on getting those bags to Lusaka,Luggage Issue
Could you update me on the suitcase please? The online and phone tracking told me nothing. I was told I'd have it back yesterday!,Luggage Issue
thank you. Been trying for two days to set this up.,Satisfied
completed form but doubt it's any use. UA doesn't care. 6 day vacation will now be 5. Sure UA won't feel responsibility for that...,Flight Issue
Definitely a compliment! I really thought my bag was lost after it was sent on to another airport. In the end I am a happy customer,Satisfied
thanx so much. You followed through and emailed me a $1000 ticket voucher. #unitedairlines they do care,Satisfied
"this will definitely be a trip to remember EWR-STI second of the season, first on seat 35A because it pays to be loyal!",Satisfied
"..back for the expensive holiday, he worked all year to pay for, that you RUINED! We want compensation &amp; his original case back!",Luggage Issue
thanks United I understand that. But he would actually like his own bag back! What have you done with it?! He also wants the money..,Luggage Issue
"It's still a valid flight. Just seems strange to delay for Late Flight inbound crew,  7 hours from now, when the plane is already here.",Flight Issue
if I pay you $25 and $35 for my luggage to be delivered when I arrive. Why should I have to wait 3 additional days for its delivery?,Luggage Issue
